{
  "schema_version": 1,
  "record_type": "source-capture",
  "base_oid": "aaaaaaaaaaaaaaaaaaaaaaaaaaaaaaaaaaaaaaaa",
  "archive_sha256": "bbbbbbbbbbbbbbbbbbbbbbbbbbbbbbbbbbbbbbbbbbbbbbbbbbbbbbbbbbbbbbbb",
  "manifest_sha256": "cccccccccccccccccccccccccccccccccccccccccccccccccccccccccccccccc",
  "file_count": 2,
  "allowed_untracked": [
    "new.c"
  ],
  "provenance": {},
  "complete": true
}
